kk,Welcome to the Black Parade,Ои,2055 жыл,Жоғарғы палеолит кезеңінің ескерткіштері,Қабылдап таратушы,Ержан Мерекеұлы Байтасов,Каньяда-де-Бенатандус,Бұрыштық модуляция,NGC 4273,Уильям Моррис Дейвис,Гарей,Тенозиометрия,Азия жастар теледидары,Ақкемер ауданы,I Александр,Тугаряк,Маркос Сенеси,Луна (автомат станциясы),Легион,Қазақстанның Қызыл жарты айы,Воронежское (Қостанай облысы),Б. з. д. 559 жыл,Экология (кітап),Сен-Жан-де-Ведас,Тибор Самуэли,Крояч (Разград облысы),НТК (телеарна),Танайка (өзен),Ақжұпар,Пелагиальдық саздар,Айланшөп,Степняк кентасты торабы,Қытай Халық Республикасы экономикасы,1591 жыл,Планкое,Респератор,Сен-Мартен-д'Арберу,Футзал,Бейнеу ауданы,Тыныс белгілері,Төлеген Әнуарбекұлы Үмбетбаев,Будда,Темекі шегу,Скьявон,IC 4655,Информатика (Б. о. ж.),Ашық кітапхана,Николаос Андриакопулос,Вальтерсдорф,Қарасу (Аягөздің сол саласы),Өтенай ауылдық округі,Карел Абсолон,Экономикалық стратегия,NGC 4937,Иов (Лобва тармағы),NGC 4734,Шарық,Рассольник,Ғани Иляев,Сургас,Б. з. д. 135 жыл,Платинум (футбол клубы),Мали-Вырбовник (Кюстендил облысы),Джозеф Мюррей,NGC 5686,Вакендорф I,Цеме,Көлбеу (тангенциалдық) тектоникалық қозғалыстар,Рипольес,Маяқұм,Николичевци (Кюстендил облысы),NGC 2228,Көкшіл көкшегүл,Эрстед (Өлшеу техникасы),Ерсайын Валитханұлы Ихсанов,Акселерометр,NGC 152,Динамикалық байланыс,Ле-Бускат,NGC 7768,Фресслин,Один (Миннесота),Никольская (Межа тармағы),Әдеби тіл,Борковка,Абиотрофия,Петр Дмитриевич Усачев,Хоан Гарсия,NGC 534,Карл Дөниц,Материк,Хан Ордасы (ауыл),Палеонтологиялық әдіс,Атбасар өңірі,Берёзовый (Тобыш тармағы),Нязанга,Кварц,Люксметр,Андрей Иванович Лукин,Шахтинск қалалық әкімдігі
sw,Yosefu Fernandez,Claudio Marchisio,Sally Kosgei,Ushirikina,Kisiwa cha Namaranda,Mto Sabulea (Kajiado),Javier Mascherano,349,Murungaru,Reda Bellahcene,George Azcurra,317,Norimasa Atsukawa,Ludwig van Beethoven,Michael Sata,Desiigner,Wandonde,Tel Aviv,East Kano,Stitches,"Irwindale, California",Robert A. Heinlein,Team Hell No,Willem van Genk,Kilindoni,Guinea Bisau,Helena wa Sinope,35 KK,Umberto Avattaneo,Birkhadem,Babeldaob,Tunzaa,Mto Nyamugoma,Kirendille,Kikarore,Kigbanziri,Mto Nyamugamba,Kihungworo,Mto Myakaliza,Mto Itinde,Roberto Rivellino,Jimbo Katoliki la Kole,Rejista,Ronetta Smith,Milima ya Soui,Jann Aldredge-Clanton,Uwanja wa Michezo wa Okuetsu Fureai Park,Tshwaane,Mto Kanyamkochola,Ngujini,Robert Barron,Skrinikugusa,Kikunggari,Mto Munivooni,Vugha,Mto Mitano,Bolinhos de mandioca com mel,Abderrahim Achchakir,Mto Ndolo (Makueni),Juan Bautista de Zengotita Bengoa,Mvungwe,Chambaron-sur-Morge,1554 KK,1194 KK,Punda milia,Reshma,Eteri wa Vienne,Setifis,"Glendora, California",Anga-nje,Gambamiti,TaTEDO,Fozil Musaev,Buswahili,Mto Luanda (Kisumu),Rosa Gala,Serena McDonald,Gideon Asimulike Cheyo,Kimvanip,Kozi,Eneo bunge la Belgut,Rusaba,Kalimoni,1786 KK,Atomu Tanaka,Mbigili,Albert Kahasha Murhula,Fabio Cannavaro,Kodak Black,Uvivu,473,1517 KK,Mto Kathandi,Uwanja wa michezo wa Aleksandria,359,Kitigre,Mto Ungoni,Gali,Mto Chawisi,Tatu
tl,"Sindia, Cerdeña","Claver, Surigao del Norte",Nurallao,Ze'eva Cohen,Streptomyces,Kabilisang radyal,"Crema, Lombardia",Internet Explorer,Hans Christian Andersen,Papa Leo VIII,Jerick Dolormente,Big Boy Restaurants,Margaret Thatcher,Operasyong isahan,Maslenitsa,Ilog Abulog,D. L. Ashliman,Vignola-Falesina,Daemones Ceramici,Samguk Sagi,Leandro Baldemor,Lungsod ng San Marino,Haydée Coloso-Espino,Paligsahang Pang-awitin ng Eurovision 1980,Mompantero,Pamantasang Normal ng Silangang Tsina,Carate Brianza,La Cassa,Zetsuai 1989,Jason,Giussago,Talaan ng mga munisipalidad ng Malayang Konsorsiyong Komunal ng Trapani,Galliavola,Balanitis,Calauag,Marso 18,Puting Pulo,San Cipriano Po,Diskograpiya ni Annie Lennox,DZRJ-AM,Pierre Curie,Brown Flava,Inta,Aisha,Karit (dalawang kamay),Martin Nievera,Sandatahang Lakas ng Unyong Sobyetiko,Mikael Daez,Charlene Gonzales,DWJJ,30-sai no Hoken Taiiku,Bosyo,Cesa,Abbadia Cerreto,Orotelli,Yasser Marta,Kasaysayan ng NASCAR,NGC 5544,The X Factor,Eddie Romero,"Yondemasuyo, Azazel-san",Pamayanang pantao,Palasyo,Inabanga,Unibersidad ng London,Fugdi,Expansion card,Wang Xianzhi (kaligrapo),Cnidaria,"Toano, Reggio Emilia",Anglisisasyon,Programang Apollo,"Farnese, Lazio",Talaan ng mga munisipalidad ng Lalawigan ng Rieti,LGBT sa Pilipinas,Pontenure,"Intragna, Piamonte",Bobby Darin,"Santa Maria Maggiore, Bolonia",Lipad 752 ng Ukraine International Airlines,Leporano,Arzago d'Adda,Simbahang Katolika (paglilinaw),Pandemya ng COVID-19 sa Rehiyong Pampangasiwaan ng Cordillera,Alpabetong Guyarati,Figline Vegliaturo,Mitromorpha nodilirata,Vincent,Krystyna Pyszková,Unibersidad ng Middlesex,Eudicots,Eskudo ng Panama,"Asahi, Nagano",A1 (banda),Salamandra (hayop),Talaan ng mga munisipalidad ng Lalawigan ng Livorno,Bellicourt,Rachel Carson,Apendisitis,Gregorio Céspedes
ur,گلہ,ولیم ایچ مورس اسٹیٹ ہوائی اڈا,مغربی شمال وسطی ریاستیں,ایالت,ایڈرنلین,چمن چیری ریلوے اسٹیشن,پالکوڈیتی سائرام,بینکس ٹاؤن شپ، کاربن کاؤنٹی، پنسلوانیا,ینی پازار، بیلیجک,کوونگٹن، نیو یارک,60000 (عدد),سین-سویر-لا-سگنے,فاطمہ آفندی,تحصیل جتوئی,پندرہ اضلاع,ویلنگ,ولایت دیار بکر,ٹمن,دو سالہ پودا,اشبے متومبامی,1 (عدد),جعفرآباد-اخوان,ونڈر گرینڈ لٹل امیڈیس,بیشان ضلع,1276ء,تونکو عبد الرحمن یونیورسٹی کالج,حومۃ السوق,نیو کیسل، نیو ہیمپشائر,برک ایڈمز (اداکارہ),جامعہ اشرفیہ مبارک پور,ورڈز اینڈ، اینفیلڈ,چک 173/(ای بی),سینٹ-فورتنت-سر-یڑےش,کریٹ کا ترانہ,پاکستان کرکٹ ٹیم کا دورہ نیوزی لینڈ 1992-93ء,عبید اللہ بن رماحس,شچبا بلدیہ,سینٹر ٹاؤن شپ، لاپورٹ کاؤنٹی، انڈیانا,سلجوق بن دقاق,فرید پور صدر ذیلی ضلع,پاکستان کرکٹ ٹیم کا دورہ سری لنکا 1994ء,ہارس ٹوتھ ماؤنٹین,1951 (عدد),آیونہو ٹاؤن شپ، فنی کاؤنٹی، کنساس,آزادانہ محبت,نوجوت سنگھ سدھو,چانگہائی کاؤنٹی,لانوموڈیرا,لانٹان، چیر,اونٹاریو، اوہائیو,لا فونتاینی-سین-مارٹین,میگھالیہ,2175 (عدد),سید گل محمد شاہ بخاری,محسن شاہنواز رانجھا,سکندر پور، گجرات,غسان کنفانی,میائینگتھا، شویگو,ینکوساک، کہتا,برر اوک ٹاؤن شپ، ڈونیفین کاؤنٹی، کنساس,کالیگولا,الادریسیہ ضلع,شینا کھیوڑہ ریلوے اسٹیشن,سین-پرے، الے-یت-ولاینے,ڈھولک,ساوتھ ملواکی، وسکونسن,لیو!,لوہارا، اکولہ,تھامس پیئرسن (کرکٹر),ہنری آرمسٹرانگ (امپائر),برزیسکی، پینکزوو کاؤنٹی,لاڈابہیر,ماچاراویایا,ادارہ تحقیقات اسلامی,پاکستانی مصالحوں کی فہرست,گجراتی قوم,سینٹ-دوس,زرتشت نے کہا,مرکز المعارف,ضبٹیک,بھارتی خواتین کرکٹ ٹیم کا دورہ بنگلہ دیش 2024ء,سینٹ-کروسٹوفے-سر-لے-نائس,پکھڑ (علاقہ),ایڈورڈ نائٹ (کرکٹر),خود مختار شہر,فرینک فورٹ ڈاو میموریل فیلڈ,والپارایسو علاقہ,سیراکیوز سب اربن ایئرپورٹ,چودھری غلام رسول,منکرائے، گوجرخان,ایبرڈین، مسیسپی,مصابیح السنہ,واشنگٹن ٹاؤن شپ، موریس کاؤنٹی، نیو جرسی,نیو ہوپ، نکولس کاؤنٹی، مغربی ورجینیا,سوہیر,فرینک میکورٹ,اولین ٹیسٹ میں پانچ وکٹ حاصل کرنے والے بھارتی کھلاڑی,سشمت گھوش,لثوی حروف صحیح,احمد بن عبد الجواد صفطی
en,Guy I Embriaco,Santa Cruz Wharf,Mourning Mothers,Tom Revill,James of Verona,Nanzan University,Muckle Water,Sam Lawrie,The Journal of Pediatrics,MV Tassie III,Terek sandpiper,Saïd Idazza,Hamilton v Papakura District Council,Jin Guiyun,Harmon Trophy,Simos Menardos,"Masalia, Dumka",USC Corte,Monuments Museum (Kastoria),Workers' Party (Togo),Fáze pád,John Macnaghten Whittaker,Clay McShane,Polynoncus aeger,Muslimaabad railway station,Three Card Monte (film),Frizinghall railway station,Mohd Isa Abdul Samad,Excipient,Sam Latus,Kola Shakank,"Ulaştı, Baykan",Cow Creek Band of Umpqua Tribe of Indians,Church of Saint Peter in Gallicantu,Kotoku Royals F.C.,Tour de Giottani,Control by deprivation,Overflowing River,Alberto Bonucci,Langenbrettach,African Independence Party,Fei Xiaotong,Mende Kikakui script,Torrens Bridge railway station,Birkot hashachar,Carolijn,Switchback Railway,NDUFAF4,"Sharon, New Jersey",Coinage Act of 1864,Human Research Facility Holter Monitor,Petechia,Spliatsch Castle,USS Albemarle (AV-5),Connecticut Route 150,Jillian Babin,Pubudu Seneviratne,Tromsøysund Tunnel,Colorado State Highway 62,Rosa 'Chrysler Imperial',Goednes,Joseph Fickler,Florida State Road 166,Concorezzo,Erythroxylum,Nanooravia,1989 California Angels season,Kate Barnard,Lewis and Clark County Hospital Historic District,Stuff (Stuff album),Robin Luke,South Hampshire Reform Jewish Community,Roberta Blackgoat,La Mairena,List of émigré musicians from Nazi Europe who settled in Britain,David Mahoney (soccer),Bhargav Bhatt (mathematician),Randolph M. Nesse,Outline of ancient Rome,Cephalorhyncha (genus),Grit Müller,Willie Mae Allen,Jane Cave,Metro in Kraków,Paul Thys,Diane Passage,Mardasovo,Mark Twain,"Bakers Beach, Tasmania",Jason O'Halloran (motorcyclist),Dónal O'Neill,Yoshiko Shigekane,Darlene Rowden,Frank H. Peterson Academies of Technology,John Hanger,List of music video games,The Boat Builder,Martians Come Back!,List of Cypriot football transfers winter 2010–11,Balen-Keiheuvel Aerodrome
fr,Kenji Sakai,Université Hassan-II de Casablanca,Volkswagen Vento,Vatica brunigii,Cage à lapins,NRP Foca (1917),RY X,Juin 1772,Gardien rouge,Combats de maître,Sœurs Dionne,Sabalan (quartier de Téhéran),The River in Reverse,Fernand Van den Corput,Piero Quispe,Saint-Laurent-de-la-Prée,Kings Norton,Freddy Sanchez,Suzuki 125 Burgman,Courage,Charles Gill,Some Voices,Jonas Holmkvist,Fómeque,Kyŏngje yukchŏn,Anna Mürset,Fonds de vieillissement (Belgique),Convergence syndicale,Giacomo Quarenghi,Acmaeoderella perroti,Noël Nicolas Coypel,Vague de violence israélo-palestinienne de 2015-2017,(30233) 2000 GJ161,American Bandstand,Harry Blech,Association pour le rayonnement de l'Opéra national de Paris,Île Sainte-Catherine (Vienne),Naissance en 1049,Wrzeście (Lębork),Hans Riemann,Michel Commelin,Kotapounga,François Gabourg,Zouhair Marour,Championnat de France de football de National 3,South Kyme,Cité Henri IV,Rafraîchissement de la mémoire,Marie-Louise Gigout-Boëllmann,Ram Etwareea,Hippolyte Mars,Côte d'Ivoire aux Jeux olympiques d'été de 2004,Église Saint-Julien-l'Hospitalier d'Agnat,Pyong Lee,Parti sauveur du Honduras,Les Noces barbares,Saint-Denis (Seine-Saint-Denis),Archevêché orthodoxe grec d'Amérique,"L'Occident (film, 1938)",Argos Amphilochium,Paul Néaoutyine,Comilla (district),Dollar de Terre-Neuve,Sexy MF,Le moment est venu de dire ce que j'ai vu,Ponnambalam Arunachalam,Telgruc-sur-Mer,Château de Pouzy,Sofidif,Bibliothèque de Käpylä,Patrick Brüll,Alan Davey,Ed Benedict,Burton Cummings,Stanwellia puna,Chronographe balistique,Alpha Sagittarii,Heusden-Zolder,Mostki (Basses-Carpates),Frank Andriat,Opération Priboï,Club Atlético Marbella,"Immeuble au 13, rue Gresset de Nantes",Darren Gilford,Cheb Akil,Symphonie no 1 de Bruckner,Handelszeitung,704,Tour de la province de Milan,Sindo (département),Arabes jamaïcains,(91275) Billsmith,Mus spicilegus,Relations entre le Koweït et le Qatar,Aline Seitz,Ptyodactylus homolepis,Port Jefferson,Assuras,Saison 2005 de la Super League,Careca
hi,कैनाबिडियोल (CBD),"ढकुवाखना, लखीमपुर",मामा बालेश्वर दयाल,भारतीय विज्ञान कांग्रेस,"चौरी, बेरीनाग तहसील",पंचकुला जिला,आस्ट्रिया की अज़ादी पार्टी,उल्टा सीधा (1985 फ़िल्म),विलियम एंडरसन (क्रिकेट अंपायर),संस्कृति विश्वविद्यालय,गंगा दामोदर एक्स्प्रेस ३३२९,डिपाडीह,कश्मीर विवाद,चीन-प्रशांत संबंध,मोहनिया,चम्बल घाट,बोवेन तकनीक,खार्डी,अबू सईद (कार्यकर्ता),बनानाल द्वीप,मनर,बाल मिठाई,"नगला पंखानी गाँव, कोइल (अलीगढ़)",मंडुआडीह रेलवे स्टेशन,इग्लेसिया दे सान जुआन (कमोजा),दक्षिण कारो नदी,अल्तमास कबीर,"ब्लफटन, इंडियाना",आख्मद मूसावि हिंदि,"खगमरा कोट, अल्मोडा तहसील",महाराष्ट्र विधान सभा,"महरागांव, भनोली तहसील",1968 ऑस्ट्रेलियाई ओपन टेनिस प्रतियोगिता - पुरुष एकल,क्रिश्चियन कॉलेज,डेस्पराडो (फिल्म),हॉटलाइन,भारतीय परमाणु परीक्षण,ट्रिब्युना ऑफ़ द युफ़िज्जी,इस्तोर-ओ-नल,२७ अक्टूबर,काली मिर्च,खुदवान,बेग़ाना,ध्यान (क्रिया),कॉसमॉस (हम्बोल्ट की रचना),गोभी मुलुगु पेराटु,रिश्तन जी सियासत,राष्ट्रीय राजमार्ग ३३४बी (भारत),बालावतार,स्पैन (अभियंत्रिकी),कंप्यूटर की भौतिक सुरक्षा,"नवाड खेडा, हल्द्वानी तहसील",अर्चना (1974 फ़िल्म),चर्चगेट रेलवे स्टेशन,धालभूमगढ़,अहमदपुर,ग्दान्स्क बंदरगाह,पेनेलोपे क्रूज़,क्वांटम ऑफ सोलेस,प्रोटैक्टीनियम,नगीन,रुपया चिह्न,"कोरजाना गाँव, छेरिया-बरियारपुर (बेगूसराय)",बैंक ऑफ भूटान,सूर्य सिंह बेसरा,एथर एनर्जी,"नन्दकेसरी, थराली तहसील",हेलवाक,महाप्रस्थानिकपर्व,हामिद हसन,"चैल (तहसील), कौशाम्बी",एनजीसी 6751,पर्यटन भूगोल,चेक विकिपीडिया,गीइज़ लिपि,भारतीय मानचित्रकला,"बेराईचक गाँव, सहकुंड (भागलपुर)",फ़्री स्टेट प्रान्त,महात्मा गाँधी सेतु,"सहसपुर विधानसभा निर्वाचन क्षेत्र, उत्तराखण्ड",ओरदा रायगढ मण्डल,सुमन सहाय,जापान का संविधान,"नासोपुर गाँव, सुलतानगंज (भागलपुर)",फलित ज्योतिष,डीडी बांग्ला,एन बी ए सीज़न २००४ - ०५,"चमाली-चौथान-४, थलीसैंण तहसील",अमरनीदि,कबाल,"कैथवारी गाँव, कोइल (अलीगढ़)",इल्हाम,छोटा भारतीय कस्तूरी बिलाव,दरावड़ का क़िला,"खिजारचक गाँव, टेघरा (बेगूसराय)","पोखरपुर गाँव, पानदारक (पटना)",पिशाच,1992 विम्बलडन टेनिस प्रतियोगिता - महिला एकल,अब्दुल शकूर (स्वतंत्रता संग्राम सेनानी),अन्नवरं (कडप)
ru,"Богуты (озеро, низовья реки Богуты)","Бебутов, Василий Осипович",Берег (Рамешковский район),Флаг Коста-Рики,"Сноу, Джек",Шаллоденбах,Похоть,Гелиевая звезда,"Сиуда, Илья Петрович",Трошиновка,Комсомольское сельское муниципальное образование,"Панофка, Теодор","Питерс, Джелани",Дольни-Кубин,Атток (округ),Сборная Дании по регби,Смультринг,"Дагба, Колен",Fusicrimites nanpanjiangensis,Ежовник (семейство Амарантовые),Thales Alenia Space,Кибири,Хоральная синагога (Минск),Саша Грей,Пьянфеи,Ириба,Ахаггар,"Франке, Герман",Антисемитизм (термин),Бенедикт XIV,Мокенский язык,Здравоохранение в Брунее,"Дулов, Александр Иванович",Магнитное склонение,Внутренний мир,Пледельяк,Разубоживание,"Губонин, Пётр Ионович",Катастрофа DC-8 под Новым Орлеаном,Исследовательская ложа,Порт-Кэмпбелл (национальный парк),Духовная прелесть,"Маслаковец, Николай Алексеевич","Бернштейн, Джош","Плускота, Натали","Адиви, Рехавья","Кузьмин, Аполлон Григорьевич","Линдвалл, Одри",Новосёлки (Сырокоренское сельское поселение),"Тайлер, Фрэнсис","Румянцев, Александр Степанович",Ак-Терек (Чаткальский район),"Тихомиров, Владимир Андреевич (Герой Советского Союза)",Листерии,"Муравьёва, Елена Александровна",Allocotaphis,"Редкобородый, Владимир Степанович",Луций Тарий Руф,Вылча (жудец),"Полимбетов, Сейтжан",Соглашение Саломон-Лосано,"Кузнецов, Николай Леонтьевич","Лазович, Катарина","Застава, Юлия","Айтаханов, Куаныш Айтаханулы",Пирсинг шеи,Мальорка (тайфа),Стоянка (село),Мигелон,Национальная консерватория Греции,"Никонов, Владимир Андреевич",Прокурор,"Дибиргаджиев, Джамал Усумиевич",Рыночный фундаментализм,Шушенская улица (Москва),"Газиева, Севиль Гамзат кызы",Юлия Сервиана Паулина,Lao Central Airlines,Цзинань-центр,Хаммерфест,"Монтгомери, Тим",Кубок мира по дартсу 2016,Queen at Wembley,Манджиль,"Высокинский, Александр Геннадьевич",Лебеда,Еврейское кладбище (Аугсбург),"Бурдин, Сергей Кузьмич","Кристиансен, Роджер",Губернатор Кемеровской области — Кузбасса,Двусторонне-симметричные,Голованевский район,"Хожаназаров, Турганбай Жумамуратович","Домбровский, Олег Иванович",Мехмед II,Таракановский форт,"Кайванто, Киммо",Навада (округ),Hepsidera,"Макклоски, Джон"
fi,Kaulukset,Anaerobinen eliö,Gian Piero Ventura,Backstreet’s Back,Matalalattiabussi,Darren Young,Chaosnet,Bach Alto Cantatas,Jaani Peuhu,Karkeakarvainen bosnianajokoira,Harry Reidin kansainvälinen lentoasema,Pull and Bear,Christian Rabjerg Madsen,Jämtland,Nicolas Maranda,WWE 2K17,Veikkolan parantola,Kánin László,Pyhimmän ilmoituksen ylin ritarikunta,Shımbay,Rf-ablaatio,GP3 Abu Dhabin Grand Prix 2016,Einar H. Kvaran,Árpádin suku,"Suolampi (Ähtäri, Heinämäki)",Good (elokuva),Luettelo Helsingin julkisista taideteoksista ja muistomerkeistä,Xia-dynastia,"Sabrina, teininoita",Gennadi Prigoda,The Walking Dead,Lijiang,BMW 7-sarja,Creticus,Anna Huvinen,Cape Coastin yliopisto,72 (luku),M∆CHINE,Yrjö Kallisen puisto,Ashdown Forest,Aurinkokellot,Flamingokukat,Step Back in Time,318,Annankadun kulmassa,Mindanaon autonominen muslimialue,Spooky Lady’s Sideshow,Heimo (kansatiede),Juhani Raiskinen,Aku Ankka,Hua yang shao nian shao nu,Kuusjärvi (Joensuu),Vanuatunmesikko,Aileen Wuornos,Osmo Hyvönen,Josh Gros,Jacques Féréol Mazas,Vladimir Petljakov,Cyberpunk 2077,Rajaturvallisuusunioni,Kiefer Sutherland,Fuck Vivaldi,Jäähyväiset tytöille,Pantoteenihappo,BBC,Villealfa,Delfoin ajomies,Estanislao Esteban Karlic,Sandy Cowan,Talonpoikaiskansan puolue,Sergei Bakulin,’Til Tuesday,Suovillat,Rantakasvien vyöhyke,Ayumi Miyazaki,"Veljeni, Leijonamieli",Barduuna,Antonina Krivošapka,Kypäräinen,Uppsalan hiippakunta,Virginia Hall,Mitja Robar,Utajärvi,Sysi-imarteet,Barret Oliver,Max Blumenthal,Helmikirjonta,Turkin vaakuna,Vesirutot,Massa (joki),Höytiäisen kanava,Apumatti,Kotijoukkojen esikunta,Tommi Maunula,Irma Helin,Iso Vuorijärvi (Keuruu),Ortodoksinen seminaari,Lipara,Zvonimir Soldo,"Ahvenjärvi (Jämsä, Halli)"
