en,Fitou AOC,Vittorio G. Rossi,Zee News,Pinaleño Mountains,Rupen River (Gir),Cor Schuuring,Qosheh Tut,Novoaltybayevo,Evany José Metzker,August von der Heydt,Trump Parc,Anthea Fraser,Nelly Hooper Ludbrook,Peter Hansen (actor),Garin Higgins,Alastair Dunnett,Albert Glover,Covenant Beach Bible Camp,Art Smakaj,Highline179,Bokey Orda District,Fender's blue butterfly,James Macadam Hare,Mohammed Mosharref Hossain,Heraclio Ruggia,Geography of Australia,Evatt Foundation,Kwok Kam-hung,Hot Wheels: Stunt Track Challenge,Munir Bhatti,1978 New York gubernatorial election,"Danville, Missouri",Demographics of Albania,Ortygius,Gender differences in Japanese,Kaohsiung Wude Hall,Distorted (band),Philomena,Eriococcus (bug),Vijayalakshmi Ravindranath,Traboch,Läskisoosi,Jean Rousselle,List of acts of the Parliament of Great Britain from 1796,Sabine Schöffmann,Ecliptoides titoi,Josh Gillespie,Polyptych of Saint Barbara (Palma Vecchio),Jörg Stiel,Trace Amounts,Ann Townsend,2015 PNG Hunters season,Ganges Barrage Project,2018 Pocono 400,2000 Frankfurt Galaxy season,Wahida Mollick Jolly,Kahn-e Safar,Earle D. Baker,Bala Murghab,DNŠ Zavrč,Peter Leslie Smith,1997 Russian Indoor Athletics Championships,List of Brazilian films of 2013,Berlin-Wilhelmsruh station,Baldwin Beach Express,Traffic barrier,Gigantic (musical),Chinese Taipei at the 2023 World Aquatics Championships,Condor BC,"Liberty Township, Hancock County, Iowa",Nieul-sur-Mer,Reghiu (river),Cycling at the 2020 Summer Olympics – Men's cross-country,Trichilogaster,Al-Resalah Party,Simson Marine Provincial Park,Micranthocereus violaciflorus,Sheldon Gardner,Santa Isabel (TransMilenio),Klymaxx,Volleyball at the 2015 Pacific Games,Sphegina freyana,One Enterprise Center,"St. Patrick's Church (New Orleans, Louisiana)",2004 Southland Conference baseball tournament,Gleditsia assamica,Lyubov Runtso,Take Away (song),2020–21 Torino FC season,Zanthoxylum heterophyllum,Pork chop bun,Mardin Sign Language,One Hen,Clara Bang,"Don Henderson (footballer, born 1918)",Upright jerker,Princeton Municipal Airport (Maine),Feldkirch District,Temple of Confucius,Sarisophora dactylisana
en,James Francis McIndoe,Philip W. Anderson (film editor),Seema Mohile,Comparison of online dating services,Periscepsia helymus,Kelly Chan (windsurfer),Economic materialism,William Kilgour,Rho Octantis,Stardom New Blood West 2,Erwin Stricker,List of franchise cricket leagues,Irayimman Thampi,ABBA The Museum,"Gimm-Young Publishers, Inc.",Wilani,Finow Canal,Ricky Belmonte,Listed buildings in Cuerden,Darr (surname),Chuanjie Formation,Ran Wei–Later Zhao War,Larry Whigham,Isotoma axillaris,Tollmien–Schlichting wave,Padroado-Propaganda Schism,Broad Bay Manor,Paul Ranger,10th Guards Budapest Rifle Corps,Blue Saxophone,Ranjit Singh of Bharatpur,O Deus ego amo te,"Çiftlikköy, Kalecik",Christine Harris (author),"St. George's Church, Mylapra",Propaganda in Japan,Battle of Marj al-Saffar (1126),Kooiwijk,Alfonsina Bueno,India–Iraq relations,Action of 18 May 1657,South Iwo Jima,Louis-Guillaume Perreaux,A Slight Case of Overbombing,GEKKO XII,Gemar Mills,Slutsk-Kletsk Yeshiva,Plaza Patria metro station,Jerald Johnson,Peyvast,Oskowo,Todd Cruz,Informant,Louisville Cardinals baseball,2022 Jersey Shore 150,Kalia Kulothungan,Fartun Abukar Omar,The D-Generation,Corduroy road,Dream Painter,2006 Hertsmere Borough Council election,Jacob Biamonte,Drill press,Sodalitas Litterarum Vistulana,Satyrium nepalense,Dairy Price Support Program,Colin Bloomfield,Alpha-aminoadipic semialdehyde synthase,Kate E. Griswold,UK Space Conference,Craig Grauf,Ron Henley (rapper),Nephew Tommy's Prank Phone Calls: Volume 1,Luis Juncos,Lucky: No Time for Love,Paul Crouch Jr.,Geoff Nolan,Bishul Yisrael,A Feather in Her Hat,1958 NFL Championship Game,Adulthood (2008 film),Lanka IOC,Tirathaba citrinoides,Mary Josephine Shelly,"Londonderry Township, Chester County, Pennsylvania",Boris Fiallos,Nuttin' but Love (song),KLK15,Antarcticimonas,1976 NCAA Division III soccer tournament,1927 New Zealand rugby league season,Sipaliwini District,Awaous,Liometopum,Raef (singer),Theodore B. Sachs,Colman of Templeshambo,Tehmasp Rustom Mogul,1891,"Kimita, Hiroshima"
fr,Société médicale des hôpitaux de Paris,Ratanice,John Roberts (architecte),Mosquée d'İsa Bey,Équipe d'Allemagne féminine de football des moins de 17 ans,Tarikhaneh,Robert Małek,Comté de Ravalli,Hagryphus,Upper Nyack Snowshoe Cabin,(37585) 1990 VQ8,Baltimore City College,La Belle Excentrique,Passariano (département),Organisation mondiale des jeunes espérantophones,HAT-P-2 b,Tennis de table aux Jeux africains de 1978,Madagascar : Opération Pingouins,Lučina (Ćićevac),Cattle Cabin,Liste des cathédrales du Pérou,Sedum andegavense,Amphore (unité),Duncan Fraser,Saponcourt,Muraille de Bâle,Arbre d'Anthony Hordern,Plan de classement,(524366) 2001 XR254,Kolwezi (district),Move in the Right Direction,Jean le Bel,Château-des-Prés,Albert van Hoobrouck de Fiennes,Richard Butler (2e comte de Glengall),Forêt nationale d'Angelina,Gebhard Ier de Ratisbonne,Débenture,Le Petit Bonheur,Mandy Poitras,Paroisse de Springfield,Double Switch,Stephen Andrea Mpashi,Geomyza tripunctata,Mercedes-Benz Classe C,1824 au théâtre,Paulo Villas Bôas de Almeida,"Hellgate (film, 1952)",André Japy (aviateur),Saison 1967-1968 du CR Belcourt,Station biologique de Lammi,Monuments nationaux de Ključ,Jean-Michel Anctil,Richard Powell,Massette à larges feuilles,Leo van Aken,Hyles perkinsi,Paroisse de Sainte-Héléna,Copa Mercosur 1999,Affaire Sophie Toscan du Plantier,Ligne 3a du tramway d'Île-de-France,Championnat d'Espagne de football 1988-1989,Club d'aviron Getxo,Club de supporteurs,Hong Kong Open masculin 2014,Samuel-Martin Eno Belinga,Karl-Heinz Kämmerling,Château de Frontone,Élections fédérales canadiennes de 2006 au Québec,Liste des primats actuels des Églises orientales,Maison du 14 rue aux Namps à Caen,2007 en mathématiques,Phare de Mull of Galloway,Les Chevaliers du Zodiaque (film),Vol Air Canada 759,Si Mustapha,Liste des types de bateaux,Wojcieszyn (Mazovie),Christian Perez (football),Bell 212,Living in a Ghost Town,Littérature biélorusse,Němčičky (district de Brno-Campagne),Suzuka Hatakeyama,Communauté d'agglomération du Pays de l'Or,Banshenchas,Yared Zeleke,Yvonne Knibiehler,Musaraigne,Fenioux (Charente-Maritime),Delivering Milo,Monument de la Constitution,Littérature de la Mauritanie,Huasong,Saint-Léonard-de-Noblat,District de Mamers,Université de Corée (métro de Séoul),1er septembre dans les chemins de fer,Palais Ioussoupov de la perspective Nevski,Cochinchine
hi,भारत में मृत्युदण्ड,न्युज ट्वान्टी-फोर टेलीविजन,"डोला, अनूपपुर",मिसा,मौलि चन्द्र शर्मा,मोल्डिंग,विशु भटनागर,साहित्‍य भारती,2002 शीतकालीन ओलंपिक पदक तालिका,"पैराग्लाइडिंग विश्व कप, भारत, २०१५",सामाजिक सम्बन्ध,दांडेली,द्विकपर्दी कपाट,शब्दांत,"अगरहन गाँव, हवेली-खड़गपुर (मुंगेर)",श्रीरामपुर तालुका,आइडिया जल्सा,चबूतरा,मोरेश्वर वासुदेव अभ्यंकर,2022 अफगानिस्तान भूकंप,ओकेरा बसकम,राय़पुर उपज़िला,यूडोरा वेल्टी,जुआन मैनुअल सैंटोस,चिलमत्तूर,मृगावती (वैशाली),"आमकाटल-उ०प०-२, यमकेश्वर तहसील",विलियम ह्यूज (भूगोलवेत्ता),जनगाँव,बलदेव राज चोपड़ा,2023 उत्तरखण्ड सुरंग उद्धार,"डौकी गाँव, फ़तेहाबाद (आगरा)",1940 में रिलीज बॉलीवुड फिल्में,"हनुमाननगर गाँव, बलिया (बेगूसराय)",डेथ रेस 2,मिर्ज़ा सलीम,पोई (जगल),अमानी विलियम्स हंट अब्दुल्ला,"घिमिडिया-चौथान-१, थलीसैंण तहसील","हवाल बाग फार्म, अल्मोडा तहसील","सेलमी,संभल (मुरादाबाद)",सम-ऊँगली खुरदार,ढीमरखेड़ा,मैक्रो वायरस ( कम्प्यूटिंग ),अका भाषा,पाकिस्तान सोशल डेमोक्रेटिक मूवमेंट,मधुश्री,सयाजीराव म्यूजिक कालेज,हान्नेस आल्फवेन,गुंडा चतुर्थ,न्गूनी भाषाएँ,आतिथ्य उद्योग,"नैशनल गैलरी, लंदन",जगदीश गुप्त,रिकी लालथलामुआना,संवातन,कंपनी लॉ बोर्ड,मुम्बई मोनोरेल,नेमदारगंज,"रीठा, चम्पावत तहसील",अर्जेण्टीना क्रिकेट टीम,कृतिका शर्मा,महावीर सिंह फोगाट,२००९ इंडियन वेल्स मास्टर्स,खाजुर्बरी,"पदार्थपुर,संभल (मुरादाबाद)",सिमरन हेटमायर,सुकिन्दा,स्टेफ़नी जालेन,इस्लामी परामर्शक सभा (ईरान),आई आई एफ ए सर्वश्रेष्ठ फ़िल्म,929,कवींद्राचार्य सरस्वती,एपोस्टोलिक नंसियेचर,नेयवेली,त्रिधा चौधरी,श्रृंखला खतिवड़ा,आंतरिक डिज़ाइन,कुमारकोम पक्षी अभयारण्य,निकोलस फेराबी,शम्मी (अभिनेत्री),खेमसिंह गिल,केन घोष,अमर दीप (1979 फ़िल्म),किंडर जॉय,तेवर,लक्ष्मण दुबे,"जगुवा सराय पीठ गाँव, हंडिया (इलाहाबाद)",कैच (क्रिकेट),आरसीएन टेलीविज़न,रेवाडी शहर,चंग नृत्य,"फुलवरिया गाँव, टेघरा (बेगूसराय)","सुतोली, भिकियासैण तहसील",तारा सुतारिया,भाद्रपद कृष्ण चतुर्दशी,हीट डाॅम,भिण्ड लोक सभा निर्वाचन क्षेत्र,बालकुंद्रा,तेल रिसाव
ru,"Кукулич, Андрей","Суханкина, Маргарита Анатольевна",Фермана (район),"Кельчин, Михаил Никифорович",Двигателестроение России,Уиндермир (Флорида),"Коссович, Игнатий Андреевич",Золка Пятая,Плавание на чемпионате мира по водным видам спорта 2007,Корреспондентский театр,Йона (греки),"Челюскин, Семён Иванович",Артинов модуль,"Кейзер, Брюно де",Гептасульфид пентацерия,Thailand orthohantavirus,"Алянчиков, Константин Николаевич",Иона Яшезерский,"Дамм, Арвид Герхард",Зевок в играх,"Грюнер, Оливье","Вилькен, Виктор Викторович","Деспотовский, Филип","Обер, Брижитт (актриса)",Хамида Алимджана (станция метро),Armania,Пятипроцентная оговорка,Гуго VII фон Эгисхейм-Дагсбург,Берлинцы,Большой пестробрюхий буревестник,Траурные какаду,Мария Павловна Мекленбург-Шверинская,Брайтенталь (Швабия),Человеколось,"Павловский, Иосиф",Михаило-Архангельский собор (Кокшетау),"Кретьен, Саймон","Уильямс, Лиз",Sassy Swings Again,Юрьевка (Царичанский район),"Алмейда, Угу",Jinjer,U-351,1647 год в науке,Плантарный фасциит,Пётр Великий (атомный крейсер),"Медведев, Александр Юрьевич","Венцкович-Лигети, Зофия Людвиговна",Лимнофильные животные,Здания Императорского фарфорового завода,"Ли, Дженнифер (кинорежиссёр)","Фалютинская, Вера Евгеньевна","Совгиренко, Андрей Викторович",Иллертиссен,Сунь Вэйши,Дубай,"Пульман, Мария Михайловна",Вьялиха,"Королевич, Евгений Витольдович","Капелл, Уильям",Хозрасчёт,Кранхуэлл (станция),"Лембикиса, Декстер",Джон Доу (Секретные материалы),Флуоресценция в биологических исследованиях,ФАС (футбольный клуб),Ин-Грид,Nocturnus (мини-альбом),Сан-Лукас-Охитлан,"Маклоухорн, Трой",Амьен-7 (кантон),"Филлип, Энди",Лёгкие крейсера типа «Дюка д’Аоста»,Чемпионат Италии по кёрлингу среди мужчин 2023,"Колтакова, Меланья Ефимовна","Пискунов, Сергей Вадимович",Тюрино (Астраханская область),Массовое убийство в Ногылли,Травянка (приток Весляны),Орден Жукова,"Зайниев, Нуриддин Зайниевич","Мельхерс, Пауль Лудольф",Льерваль,"Аведикян, Тигран",Wah Ching,Карденете,Гусятниковы,"Рурк, Констанс","Бьенэме, Дидье",Нормальный кубический метр,"Double, Double, Boy in Trouble",Парламентские выборы в Албании (1992),"Симонов, Михаил Петрович","Приходкин, Валерий Дмитриевич",Нагатинский Затон (станция метро),"Подоба, Иван Григорьевич",Герб Малайзии,"Лебединский, Григорий Исаевич",Холерный токсин,"Визинтин, Омар"
fi,Kovera kulma,Valkoinen länsiylämaanterrieri,Luettelo kirjasarjojen Eleniumin taru ja Tamulin taru henkilöhahmoista,Castanopsis,Reniumheksafluoridi,Morsiosorsa,Youssoupha,Kirjallisuusvuosi 1975,Khorāsān-e Razavi,Spice and Wolf,Mansikkakoski,Kurkilampi (Mäntyharju),Burgasin kansainvälinen lentoasema,WebInfo,Éric Bélanger,Remu Aaltonen,New York,Johan Viktor Johnsson,Máximo Diego Pujol,Relletti,Pateniemen seisake,C. Northcote Parkinson,Colored Sands,Rauno,Melutaidegalleria,Alpertti Rieskjärvi,Luettelo Sierra Leonen kansallismonumenteista,Valkosiipitiira,Yrjö Salmela (kauppaneuvos),Vares – Sheriffi,Jakobstads gymnasium,Kärkkäinen (tavaratalo),Likasi,Anter Yaşa,Outokummun ortodoksinen kirkko,Aleksandr Jakovlev,Calgary–Edmonton-käytävä,Luis Monti,Sinclair QL,Jorma Keino,Dubstep,Aavelaiva (vuoden 2002 elokuva),Lokki Joonatan,Balduin IV,"One MC, One Delay",Salva veritate,Bokken Lasson,Machher Jhol,Dominikaanien historia,Cinémathèque française,Absorptiojääkaappi,Deloksen teatteri,Vladlen Tatarski,Uusi Sherlock,Trollhättanin kirkko,Oscar-gaala 1996,Operaatio Collar,MC Raaka Pee,Ossi Kanervo,Kate Raworth,Grace O’Malley,Ishiharan testi,Vapaudenristin ritarikunta,Coahuila,Robert Swindells,Japanin pörssi,M-7 (1933),Helena Vierikko,Brian Greenhoff,Luxemburg,Muriel Day,Mékrou,Päärynämehu,Rekrygaala,Angelus Kujur,Arvo Rytkönen,Ammunta kesäolympialaisissa 2024,Yhdysvaltain varapresidentin puoliso,Herrakansa viidakossa,Isak Penttala,Domino Recording Company,Tommy Lindgren,Frode Andresen,Shottonin rautatieasema,Miesten joukkuevoimistelu kesäolympialaisissa 1908,Keith Urban,Coitus Int,"Vähäjärvi (Orivesi, Eräslahti)",Arizonan suuri meteoriittikraatteri,Anna-Lea Kopperi,Bohumil Golián,Riadin lentotukikohta,Hangaslampi (Suonenjoki),Kolmannen persoonan ammuntapeli,Tyyne Salokannel,Lapin Kulta,Heechee,Kreikkalainen tragedia,Vrindavan,Ruskoleiju
hu,Fiú 1000 méteres rövidpályás gyorskorcsolya a 2020. évi téli ifjúsági olimpiai játékokon,Stazione di Benevento Rione Libertà,Anasztásziosz Szidirópulosz,Blanzac (Haute-Vienne),Main Street (Gibraltár),Synallaxis kollari,Sid község,Józsa János (műfordító),Polgármester-választások Fehérgyarmaton,Document no.6,9020 Eucryphia,1995-ös Formula–1 európai nagydíj,Villers-le-Rond,Dollárjel,Ophthalamia,Oros megállóhely,Bray-en-Val,Stock fotó,Blois-sur-Seille,Donáth Lili,Beutin,Hongkongi Filmarchívum,Gujdó,Heinrich Wuttke,Leindler László,Törökország a 2018. évi téli olimpiai játékokon,Sursilvan nyelvjárás,Infinity (Guru Josh),3621 Curtis,Mészáros Árpád (labdarúgó),54-es metróvonal (Amszterdam),Rózsás őzlábgomba,The House,Regence,9465 Fergusonsam,Lahojszk,"Christian Ramirez (labdarúgó, 1991)",1427 az irodalomban,Lurai Nemzeti Park,1957-es magyar úszóbajnokság,2012-es Guangzhou International Women’s Open – páros,215-ös busz (Budapest),Sinkanszen 0-s sorozat,Emberöltő,Négyszög,Bystřička,Jak Crawford,Batuka,1683 Castafiore,Hans Temple,Wimbledon női páros döntői,SÍ busz (Budapest),Cécile Stanislas Xavier de Girardin,Giotto (űrszonda),Gyep (folyó),Horace Vernet,Nagy Ervin (labdarúgó),Sylvain Wiltord,HMS Norfolk (nehézcirkáló),La Rouquette,Castiglion Fiorentino,Felsőszőcs Kultúra,Mogilec,Evolve (videójáték),Kurt Waitzmann,Alfonz gandiai herceg,1703 az irodalomban,1996-os futsal-világbajnokság,André Van De Werve De Vorsselaer,Strömstad község,Subate,Zelnicemeggy,Amurrio Club,Burkhard osztrák őrgróf,Adam Andersson,Lüszisztraté (karakter),A félszemű (film),Horní Ves (Trstěnice),Radoszláv István szerb király,Szultán Mohamed,Kenneth Anger,Chepy,Bresse Vallons,Forgó László (villamosmérnök),2013-as MotoGP katalán nagydíj,Apocalyptic Feasting,Elwha,Dudás Róbert Gyula,Oniferi,Ki kicsoda a hírközlésben?,Isabella Plains,La Chaise-Dieu,Berlini nyilatkozat,2009-es US Open – női egyes,Szinkronúszás a 2012. évi nyári olimpiai játékokon,Szergej Alekszandrovics Szvetlov,Dőry Gábor,Boltozat,Koszmosz–453,Üvegbetegség
he,הדלתה של הקולורדו,רופרט פנפאד'ר,עצם מיאל,ויטה קלאב,ועדת העבודה והרווחה,רית'ם אנד בלוז,עשר אצבעות,הארמייה השישית (ורמאכט),אלסקצפל,דז'ב,המשוטט,גלישת גלים במשחקים האולימפיים,סאורון,ריימן 2: הבריחה הגדולה,קבר דריווש הראשון,אדמה (עיר מקראית),"אני, רובוט (סרט)",המכון הפוליטכני רנסלר,ג'יימס וורד (פסיכולוג),הגיבור שלי (סדרת טלוויזיה),איליי בראון,לצאת מדיכאון (אלבום),הקהילה הכלכלית של מדינות מערב אפריקה,חצי האי בורגס,מסתורין (סוגה),244 סיטה,חן קוגל,מיפמורטיד,YG מארלי,ענק קרח,תראפסידה,זלמן רייזן,פוקילותרמיות,פאל שמיט,Lokita,אבי בן-שמחון,קובייה קטומה,חבר (הלכה),אנט אוטול,אליפות אירופה בכדורסל 1979,A Holly Dolly Christmas,טוקן גיאני,עונת 1986/1987 בליגה הארצית,אזור אדמאווה,ליאורה חשין,תלמוד שטיינזלץ,נבחרת כף ורדה בכדורסל,הדיוויזיה ה-197 (האימפריה הגרמנית),לואיס ארטימה,לוסיטנים,אוסו-איראטי,שמואל שמעלקא טויבש,שנות ה-20 של המאה ה-10,אוסטריה באירוויזיון 1961,שלום פוברסקי,גוטקס,גילנות,מישל אלוזי,אווה מריה יונסדוטיר,Supper's Ready,משפחת קרליץ,אל-מסילה,נוסבאך,יחסי בולגריה – בוסניה והרצגובינה,1460,סולטנות ברוניי (1368–1888),רפאל נדאל,נינליל,ג'ונגל האספלט,נטלי פרוז,1924 בקולנוע,טורו אוהירה,ראש המטה של כוחות ההגנה (אירלנד),ג'ו פרסל,איאיידו,בעיות השלום והסוציאליזם,קאראש,Unshine,שי ברוש,יומני האפלצ'ים,מל קלר,"לודוויג, נסיך הסן",מנדאים,דיולה גמבש,האגדה של מורדו,מנדי רודן,מיכאל חסין,רוני דורה,Good Girl Gone Bad Live,קרוליין בלקיסטון,מוצי אביב,פונשו אדאולו,קלארנס הובנר,הבורסה הלאומית ההודית לניירות ערך,טיין דיילי,כגאנות ז'ואו-ז'אן,דאנקן לורנס,המחלקה לביטחון לאומי (ספרד),יעקב הרצנשטיין,טרי אן לין
tr,Piz Bernina,Recep Koral,Gence Kuşatması (1606),Michel Rougagnou,Temporal lob epilepsisi,Furkan Yalçınkaya,Orta Sulawesi,Rubus schiedeanus,"Mahwah, New Jersey",Sivas'ta 1935 Türkiye genel seçimleri,Yosa Buson,Erwin Chargaff,2012 Yaz Olimpiyatları'nda Amerika Birleşik Devletleri,Andrena sagittagalea,Remastersys,Kedi Beşiği,Limnesiidae,Carnforth,Melek Gençoğlu,Michael Stuhlbarg,Piper ulvifolium,Bembicina,NGC 3139,Austin Motor Company,Compagnie des Indes Orientales,Teneke (roman),Cüneyt Ayral,Crassula diminuta,Yaz Olimpiyatları'nda atletizm,"Zafer, Kepez",Akan (volkan),Hurşid Ahmed Paşa,İhsan Gedik,Paços de Ferreira,Çakalın Günü,Damladere,Mitch Morse,Vezir Gambiti (roman),Appingedam,"Kurudere, Kıbrıs",Urho Castrén,Need for Speed,Matz Sels,Uskundra,"Emirhaydar, Araban",Dijital dönüşüm,"Teaneck, New Jersey",Vira Vovk,Jennifer Morrison,Ahtapot salatası,"Cumhuriyet, 19 Mayıs",Fenerbahçe (basketbol takımı) 2004-05 sezonu,Viyana,2013 Avrupa 17 Yaş Altı Futbol Şampiyonası,Çevre felsefesi,Ah Bu Şarkılar,Lethrus mugodzharicus,III. Kılıç Arslan,Orokça,NGC 7546,Öjenik,Essentials / Seçkiler 2,NGC 500,Premack ilkesi,Funda Şirinkal,Hisanori Ogawa,Gerhard Auer,Luriculus,Burak Uygur,Ester Expósito,Treyler,Kırık (film),"Lafayette, Indiana",Mehdi Tarımi,Santa María (Melque),Charybdis hawaiensis,Kars'ta 1957 Türkiye genel seçimleri,Plexippoides,Peperomia pilosa,1878 Epir İsyanı,"Başlamış, Hüyük",Schizophyllaceae,Rıza Silahlıpoda,ŞKAS,The Frames,Redd,Ezekiyel Sason,Volgograd Arena,"Strictly Confidential (film, 2024)",Andreea Bănică,Argiope pechueli,Kazuhiro Kawasumi,Amerikan Haydutları,Maaveerar Naal,Pekin-Hankou demiryolu,"Çeliktepe, Kâğıthane",Sideritis gaditana,Ze (Arap),"Kocakağan, Akhisar","1. Kadriye, Konak"
